{
  "schema_version": "m3.preprocessing_profile.schema.v1",
  "registry_id": "m3_preprocessing_profiles_corrected_v1",
  "status": "future_active",
  "description_zh": "M3 未来活动预处理配置的唯一机器权威。所有 29-subject、移动端及外部 PTT benchmark 必须按精确 profile_id 解析，不允许以自由参数或旧根目录脚本替代。",
  "description_en": "Sole machine authority for future-active M3 preprocessing profiles. Every 29-subject, mobile and external-PTT benchmark must resolve an exact profile_id; free parameters and repository-root scripts are not substitutes.",
  "future_primary_sampling_rate_hz": 400,
  "legacy_policy": "legacy_bug_compatible_is_reproduction_only",
  "training_only_statistics": true,
  "profiles": [
    {
      "profile_id": "frailty3_static_ppg_400_offline_v1",
      "status": "future_active",
      "purpose": "static_preprocessing",
      "modality": "ppg",
      "sampling_rate_hz": 400,
      "resampling": "no_resample",
      "bandpass_hz": [0.2, 8.0],
      "butterworth_order": 3,
      "phase_mode": "offline_zero_phase",
      "detrend": "linear",
      "notch": "disabled",
      "channel_order": ["RED", "IR"],
      "preserve_raw_dc_ac": true,
      "description_zh": "Frailty3 B/R 静态或恢复片段的离线零相位 PPG 前端；保留 0.2 Hz 以上缓慢生理变化，400 Hz 输入禁止重复重采样。",
      "description_en": "Offline zero-phase PPG front end for Frailty3 B/R static or recovery segments; retains slow physiology above 0.2 Hz and forbids repeated resampling of 400 Hz input."
    },
    {
      "profile_id": "frailty3_motion_ppg_400_offline_v1",
      "status": "future_active",
      "purpose": "motion_preprocessing",
      "modality": "ppg",
      "sampling_rate_hz": 400,
      "resampling": "no_resample",
      "bandpass_hz": [0.4, 8.0],
      "butterworth_order": 3,
      "phase_mode": "offline_zero_phase",
      "detrend": "linear",
      "notch": "disabled",
      "channel_order": ["RED", "IR"],
      "preserve_raw_dc_ac": true,
      "description_zh": "Frailty3 S/W 运动片段的离线零相位 PPG 前端；0.4 Hz 高通抑制慢漂移，但 raw DC/AC 另行保留用于 SQI 与幅值特征。",
      "description_en": "Offline zero-phase PPG front end for Frailty3 S/W motion segments; the 0.4 Hz high-pass suppresses slow drift while raw DC/AC remains available for SQI and amplitude features."
    },
    {
      "profile_id": "frailty3_peak_ppg_400_offline_v1",
      "status": "future_active",
      "purpose": "peak_detection_input",
      "modality": "ppg",
      "sampling_rate_hz": 400,
      "resampling": "no_resample",
      "bandpass_hz": [0.4, 8.0],
      "butterworth_order": 3,
      "phase_mode": "offline_zero_phase",
      "detrend": "linear",
      "notch": "disabled",
      "channel_order": ["RED", "IR"],
      "preserve_raw_dc_ac": true,
      "description_zh": "离线峰检测门面的唯一 Frailty3 输入配置；仅该 purpose 可传给 detect_peaks_corrected 的 profile-locked 适配层。",
      "description_en": "Sole Frailty3 input profile for the offline peak facade; only this purpose may enter the profile-locked detect_peaks_corrected adapter."
    },
    {
      "profile_id": "frailty3_denoiser_ppg_400_offline_v1",
      "status": "future_active",
      "purpose": "denoiser_input",
      "modality": "ppg",
      "sampling_rate_hz": 400,
      "resampling": "no_resample",
      "bandpass_hz": [0.4, 8.0],
      "butterworth_order": 3,
      "phase_mode": "offline_zero_phase",
      "detrend": "linear",
      "notch": "disabled",
      "channel_order": ["RED", "IR"],
      "preserve_raw_dc_ac": true,
      "description_zh": "未来低质量/运动片段 denoiser 的离线输入配置；不代表任何 denoiser 已经通过 benchmark。",
      "description_en": "Offline input profile for a future low-quality/motion denoiser; it does not claim that any denoiser has passed a benchmark."
    },
    {
      "profile_id": "mobile_ppg_400_causal_v1",
      "status": "deprecated_alias",
      "purpose": "motion_preprocessing",
      "modality": "ppg",
      "sampling_rate_hz": 400,
      "resampling": "no_resample",
      "bandpass_hz": [0.4, 8.0],
      "butterworth_order": 3,
      "phase_mode": "causal_stateful",
      "detrend": "none",
      "notch": "disabled",
      "channel_order": ["RED", "IR"],
      "preserve_raw_dc_ac": true,
      "alias_target_profile_id": "mobile_motion_ppg_400_causal_v1",
      "future_benchmark_allowed": false,
      "description_zh": "弃用兼容别名，仅指向 mobile_motion_ppg_400_causal_v1；新 benchmark 禁止直接使用。",
      "description_en": "Deprecated compatibility alias pointing only to mobile_motion_ppg_400_causal_v1; direct use is forbidden in new benchmarks."
    },
    {
      "profile_id": "mobile_static_ppg_400_causal_v1",
      "status": "future_active",
      "purpose": "static_preprocessing",
      "modality": "ppg",
      "sampling_rate_hz": 400,
      "resampling": "no_resample",
      "bandpass_hz": [0.2, 8.0],
      "butterworth_order": 3,
      "phase_mode": "causal_stateful",
      "detrend": "none",
      "notch": "disabled",
      "channel_order": ["RED", "IR"],
      "preserve_raw_dc_ac": true,
      "description_zh": "移动端 B/R 静态或恢复片段的因果有状态配置；与离线静态路线保持 0.2–8 Hz 语义，但不冒充零相位等价。",
      "description_en": "Causal stateful mobile profile for B/R static or recovery segments; preserves the offline static 0.2–8 Hz semantics without claiming zero-phase equivalence."
    },
    {
      "profile_id": "mobile_motion_ppg_400_causal_v1",
      "status": "future_active",
      "purpose": "motion_preprocessing",
      "modality": "ppg",
      "sampling_rate_hz": 400,
      "resampling": "no_resample",
      "bandpass_hz": [0.4, 8.0],
      "butterworth_order": 3,
      "phase_mode": "causal_stateful",
      "detrend": "none",
      "notch": "disabled",
      "channel_order": ["RED", "IR"],
      "preserve_raw_dc_ac": true,
      "description_zh": "移动端 S/W 运动片段的因果有状态配置；是旧 mobile_ppg_400_causal_v1 的唯一迁移目标。",
      "description_en": "Causal stateful mobile profile for S/W motion segments; the sole migration target of the old mobile_ppg_400_causal_v1 alias."
    },
    {
      "profile_id": "mobile_peak_ppg_400_causal_v1",
      "status": "future_active",
      "purpose": "peak_detection_input",
      "modality": "ppg",
      "sampling_rate_hz": 400,
      "resampling": "no_resample",
      "bandpass_hz": [0.4, 8.0],
      "butterworth_order": 3,
      "phase_mode": "causal_stateful",
      "detrend": "none",
      "notch": "disabled",
      "channel_order": ["RED", "IR"],
      "preserve_raw_dc_ac": true,
      "description_zh": "移动端峰检测门面的因果输入配置；峰 facade 只允许本配置或 frailty3_peak_ppg_400_offline_v1。",
      "description_en": "Causal input profile for the mobile peak facade; the facade accepts only this profile or frailty3_peak_ppg_400_offline_v1."
    },
    {
      "profile_id": "external_ppg_to_400_polyphase_v1",
      "status": "future_active",
      "purpose": "external_resampling",
      "modality": "ppg_resampling",
      "sampling_rate_hz": 400,
      "source_sampling_rate_hz_allowed": [256, 500],
      "target_sampling_rate_hz": 400,
      "resampling": "scipy_resample_poly",
      "shared_index_mapping_required": true,
      "mapped_payloads": ["signal", "time", "valid_mask", "peak_annotations"],
      "channel_order": ["RED", "IR"],
      "description_zh": "外部 PTT PPG 的唯一未来活动重采样配置；256/500 Hz 到 400 Hz 必须使用 SciPy resample_poly，信号、时间、mask 与峰标注共享同一索引映射。",
      "description_en": "Sole future-active external-PTT resampling profile; 256/500 Hz to 400 Hz uses SciPy resample_poly and one shared mapping for signal, time, masks and peak annotations."
    },
    {
      "profile_id": "frailty3_raw8_classifier_400_v1",
      "status": "future_active",
      "purpose": "classifier_feature_view",
      "modality": "multimodal",
      "sampling_rate_hz": 400,
      "resampling": "no_resample",
      "channel_order": ["RED", "IR", "AX_dyn", "AY_dyn", "AZ_dyn", "GX", "GY", "GZ"],
      "ppg_scaling": "per_window_median_iqr_div_1p349_no_clip_zero_iqr_no_estimate",
      "imu_scaling": "training_fold_robust_scaler_no_clip",
      "raw_context_features": ["red_dc", "ir_dc", "red_ac", "ir_ac", "red_ir_ratios"],
      "description_zh": "校正后的动态加速度 raw8 视图；与旧 sequence_8ch_v1 语义不兼容，必须在 M4 重新训练分类器。",
      "description_en": "Corrected dynamic-acceleration raw8 view; semantically incompatible with legacy sequence_8ch_v1 and therefore requires M4 classifier retraining."
    },
    {
      "profile_id": "imu_ekf_si_400_causal_v1",
      "status": "future_active_primary",
      "purpose": "imu_gravity_primary",
      "modality": "imu",
      "sampling_rate_hz": 400,
      "input_order": ["AX", "AY", "AZ", "GX", "GY", "GZ"],
      "acceleration_output_unit": "m/s^2",
      "gyroscope_output_unit": "rad/s",
      "acceleration_lowpass_hz": 20.0,
      "gyroscope_lowpass_hz": 40.0,
      "gravity_method": "quaternion_error_state_ekf_without_precalibration",
      "algorithm_key": "ekf",
      "sensor_filter_order": 3,
      "gyro_noise_density": 0.002,
      "gyro_bias_random_walk": 0.0002,
      "base_accel_angle_noise_deg": 5.0,
      "acceleration_norm_gate_g": [0.5, 1.5],
      "adaptive_r_rho_scale": 0.05,
      "adaptive_r_eta_scale_per_sec": 2.0,
      "adaptive_r_scale_max": 100.0,
      "adaptive_r_downweighted_at": 25.0,
      "initial_gyro_bias_rad_s": [0.0, 0.0, 0.0],
      "initial_tilt_sigma_deg": 20.0,
      "initial_yaw_sigma_deg": 180.0,
      "initial_gyro_bias_sigma_deg_s": 5.0,
      "gravity_update_decimation": 4,
      "minimum_tracking_sec": 0.5,
      "minimum_accepted_updates": 20,
      "tracking_tilt_sigma_deg": 10.0,
      "nis_gate_2d_99p9": 13.8155,
      "maximum_prediction_only_sec": 2.0,
      "maximum_tracking_tilt_sigma_deg": 20.0,
      "maximum_gyro_bias_rad_s": 0.35,
      "internal_dtype": "float64",
      "covariance_floor": 1e-15,
      "phase_mode": "causal_stateful",
      "silent_fallback": false,
      "jerk_definition": "vector_backward_difference_then_l2_norm_for_scalar_features",
      "description_zh": "D5 冻结的无预校准四元数误差状态 EKF 主路线；显式 SI 单位、就绪门、NIS 门和无静默 LPF 回退。",